ipstack.json

{
    "appid": "87078d70-ca1e-4dfa-9dbe-cf3fa56b99ae",
    "name": "ipstack",
    "description": "Integrates with ipstack to implement investigative actions",
    "type": "information",
    "product_vendor": "ipstack",
    "logo": "logo_ipstack.svg",
    "logo_dark": "logo_ipstack_dark.svg",
    "product_name": "ipstack",
    "product_version_regex": ".*",
    "publisher": "Splunk",
    "license": "Copyright (c) 2018-2026 Splunk Inc.",
    "app_version": "2.0.9",
    "utctime_updated": "2025-08-01T20:32:47.175802Z",
    "package_name": "phantom_ipstack",
    "main_module": "ipstack_connector.py",
    "python_version": "3.9, 3.13",
    "min_phantom_version": "5.1.0",
    "fips_compliant": true,
    "latest_tested_versions": [
        "Cloud API api.ipstack.com, June 07,2021"
    ],
    "app_wizard_version": "1.0.0",
    "configuration": {
        "access_key": {
            "description": "API Access Key",
            "data_type": "password",
            "required": true,
            "order": 0
        },
        "use_ssl": {
            "description": "Use SSL encryption",
            "data_type": "boolean",
            "default": true,
            "order": 1
        }
    },
    "actions": [
        {
            "action": "test connectivity",
            "description": "Validate the asset configuration for connectivity using supplied configuration",
            "type": "test",
            "identifier": "test_connectivity",
            "read_only": true,
            "parameters": {},
            "output": [],
            "versions": "EQ(*)"
        },
        {
            "action": "geolocate ip",
            "description": "Queries Service for IP location info",
            "type": "investigate",
            "identifier": "geolocate_ip",
            "read_only": true,
            "parameters": {
                "ip": {
                    "description": "IP to lookup",
                    "data_type": "string",
                    "required": true,
                    "primary": true,
                    "contains": [
                        "ip",
                        "ipv6"
                    ],
                    "order": 0
                }
            },
            "output": [
                {
                    "data_path": "action_result.status",
                    "data_type": "string",
                    "example_values": [
                        "success",
                        "failed"
                    ]
                },
                {
                    "data_path": "action_result.parameter.ip",
                    "data_type": "string",
                    "contains": [
                        "ip",
                        "ipv6"
                    ],
                    "column_name": "IP",
                    "column_order": 0,
                    "example_values": [
                        "192.168.0.10",
                        "24a6:205:c00b:98f7:9103:6255:bf6:19d5"
                    ]
                },
                {
                    "data_path": "action_result.data.*.city",
                    "data_type": "string",
                    "column_name": "City",
                    "column_order": 1,
                    "example_values": [
                        "Mountain View"
                    ]
                },
                {
                    "data_path": "action_result.data.*.continent_code",
                    "data_type": "string",
                    "example_values": [
                        "AS"
                    ]
                },
                {
                    "data_path": "action_result.data.*.continent_name",
                    "data_type": "string",
                    "example_values": [
                        "Asia"
                    ]
                },
                {
                    "data_path": "action_result.data.*.country_code",
                    "data_type": "string",
                    "example_values": [
                        "US"
                    ]
                },
                {
                    "data_path": "action_result.data.*.country_name",
                    "data_type": "string",
                    "column_name": "Country",
                    "column_order": 3,
                    "example_values": [
                        "United States"
                    ]
                },
                {
                    "data_path": "action_result.data.*.ip",
                    "data_type": "string",
                    "example_values": [
                        "216.58.100.174",
                        "2405:205:c00b:98f7:9103:6255:bf6:19d5"
                    ],
                    "contains": [
                        "ip",
                        "ipv6"
                    ]
                },
                {
                    "data_path": "action_result.data.*.latitude",
                    "data_type": "numeric",
                    "example_values": [
                        37.4002,
                        23.0013
                    ]
                },
                {
                    "data_path": "action_result.data.*.location.calling_code",
                    "data_type": "string",
                    "example_values": [
                        "91"
                    ]
                },
                {
                    "data_path": "action_result.data.*.location.capital",
                    "data_type": "string",
                    "example_values": [
                        "Washington D.C."
                    ]
                },
                {
                    "data_path": "action_result.data.*.location.country_flag",
                    "data_type": "string",
                    "example_values": [
                        "http://assets.ipstack.com/flags/in.svg"
                    ],
                    "contains": [
                        "url"
                    ]
                },
                {
                    "data_path": "action_result.data.*.location.country_flag_emoji",
                    "data_type": "string",
                    "example_values": [
                        "\ud83c\uddaa\ud83c\uddf3"
                    ]
                },
                {
                    "data_path": "action_result.data.*.location.country_flag_emoji_unicode",
                    "data_type": "string",
                    "example_values": [
                        "U+1F1EE U+1F1F3"
                    ]
                },
                {
                    "data_path": "action_result.data.*.location.geoname_id",
                    "data_type": "numeric",
                    "example_values": [
                        1270033
                    ]
                },
                {
                    "data_path": "action_result.data.*.location.is_eu",
                    "data_type": "boolean",
                    "example_values": [
                        true,
                        false
                    ]
                },
                {
                    "data_path": "action_result.data.*.location.languages.*.code",
                    "data_type": "string",
                    "example_values": [
                        "hi"
                    ]
                },
                {
                    "data_path": "action_result.data.*.location.languages.*.name",
                    "data_type": "string",
                    "example_values": [
                        "English"
                    ]
                },
                {
                    "data_path": "action_result.data.*.location.languages.*.native",
                    "data_type": "string",
                    "example_values": [
                        "\u0939\u000f\u0928\u094d\u0926\u0940"
                    ]
                },
                {
                    "data_path": "action_result.data.*.longitude",
                    "data_type": "numeric",
                    "example_values": [
                        -122.0004,
                        72.6007
                    ]
                },
                {
                    "data_path": "action_result.data.*.metro_code",
                    "data_type": "numeric",
                    "example_values": [
                        800
                    ]
                },
                {
                    "data_path": "action_result.data.*.region_code",
                    "data_type": "string",
                    "example_values": [
                        "CA"
                    ]
                },
                {
                    "data_path": "action_result.data.*.region_name",
                    "data_type": "string",
                    "column_name": "Region",
                    "column_order": 2,
                    "example_values": [
                        "California"
                    ]
                },
                {
                    "data_path": "action_result.data.*.time_zone",
                    "data_type": "string",
                    "example_values": [
                        "America/Los_Angeles"
                    ]
                },
                {
                    "data_path": "action_result.data.*.type",
                    "data_type": "string",
                    "example_values": [
                        "ipv6"
                    ]
                },
                {
                    "data_path": "action_result.data.*.zip",
                    "data_type": "string",
                    "example_values": [
                        "980000"
                    ]
                },
                {
                    "data_path": "action_result.data.*.zip_code",
                    "data_type": "string",
                    "example_values": [
                        "94003"
                    ]
                },
                {
                    "data_path": "action_result.summary.city",
                    "data_type": "string",
                    "example_values": [
                        "Mountain View"
                    ]
                },
                {
                    "data_path": "action_result.summary.country_code",
                    "data_type": "string",
                    "example_values": [
                        "US"
                    ]
                },
                {
                    "data_path": "action_result.message",
                    "data_type": "string",
                    "example_values": [
                        "City: Mountain View, Country code: US"
                    ]
                },
                {
                    "data_path": "summary.total_objects",
                    "data_type": "numeric",
                    "example_values": [
                        1
                    ]
                },
                {
                    "data_path": "summary.total_objects_successful",
                    "data_type": "numeric",
                    "example_values": [
                        1
                    ]
                }
            ],
            "render": {
                "type": "table"
            },
            "versions": "EQ(*)"
        },
        {
            "action": "geolocate domain",
            "description": "Geolocate a domain",
            "type": "investigate",
            "identifier": "geolocate_domain",
            "read_only": true,
            "parameters": {
                "domain": {
                    "description": "Domain to geolocate",
                    "data_type": "string",
                    "required": true,
                    "primary": true,
                    "contains": [
                        "domain",
                        "url"
                    ],
                    "order": 0
                }
            },
            "output": [
                {
                    "data_path": "action_result.status",
                    "data_type": "string",
                    "example_values": [
                        "success",
                        "failed"
                    ]
                },
                {
                    "data_path": "action_result.parameter.domain",
                    "data_type": "string",
                    "contains": [
                        "domain",
                        "url"
                    ],
                    "column_name": "Domain",
                    "column_order": 0,
                    "example_values": [
                        "https://test.com",
                        "test.com"
                    ]
                },
                {
                    "data_path": "action_result.data.*.city",
                    "data_type": "string",
                    "column_name": "City",
                    "column_order": 1,
                    "example_values": [
                        "Mountain View"
                    ]
                },
                {
                    "data_path": "action_result.data.*.continent_code",
                    "data_type": "string",
                    "example_values": [
                        "NA"
                    ]
                },
                {
                    "data_path": "action_result.data.*.continent_name",
                    "data_type": "string",
                    "example_values": [
                        "North America"
                    ]
                },
                {
                    "data_path": "action_result.data.*.country_code",
                    "data_type": "string",
                    "example_values": [
                        "US"
                    ]
                },
                {
                    "data_path": "action_result.data.*.country_name",
                    "data_type": "string",
                    "column_name": "Country",
                    "column_order": 3,
                    "example_values": [
                        "United States"
                    ]
                },
                {
                    "data_path": "action_result.data.*.ip",
                    "data_type": "string",
                    "example_values": [
                        "192.168.0.4",
                        "2607:f8a0:4005:80b::230c"
                    ],
                    "contains": [
                        "ip",
                        "ipv6"
                    ]
                },
                {
                    "data_path": "action_result.data.*.latitude",
                    "data_type": "numeric",
                    "example_values": [
                        37.4002,
                        37.001
                    ]
                },
                {
                    "data_path": "action_result.data.*.location.calling_code",
                    "data_type": "string",
                    "example_values": [
                        "1"
                    ]
                },
                {
                    "data_path": "action_result.data.*.location.capital",
                    "data_type": "string",
                    "example_values": [
                        "Washington D.C."
                    ]
                },
                {
                    "data_path": "action_result.data.*.location.country_flag",
                    "data_type": "string",
                    "example_values": [
                        "http://path.to.api.com/flags/us.svg"
                    ],
                    "contains": [
                        "url"
                    ]
                },
                {
                    "data_path": "action_result.data.*.location.country_flag_emoji",
                    "data_type": "string",
                    "example_values": [
                        "\ud83c\uddaa\ud83c\uddf8"
                    ]
                },
                {
                    "data_path": "action_result.data.*.location.country_flag_emoji_unicode",
                    "data_type": "string",
                    "example_values": [
                        "U+1F1FA U+1F1F8"
                    ]
                },
                {
                    "data_path": "action_result.data.*.location.geoname_id",
                    "data_type": "numeric",
                    "example_values": [
                        2964574
                    ]
                },
                {
                    "data_path": "action_result.data.*.location.is_eu",
                    "data_type": "boolean",
                    "example_values": [
                        true,
                        false
                    ]
                },
                {
                    "data_path": "action_result.data.*.location.languages.*.code",
                    "data_type": "string",
                    "example_values": [
                        "en"
                    ]
                },
                {
                    "data_path": "action_result.data.*.location.languages.*.name",
                    "data_type": "string",
                    "example_values": [
                        "English"
                    ]
                },
                {
                    "data_path": "action_result.data.*.location.languages.*.native",
                    "data_type": "string",
                    "example_values": [
                        "English"
                    ]
                },
                {
                    "data_path": "action_result.data.*.longitude",
                    "data_type": "numeric",
                    "example_values": [
                        -122.0004,
                        -97.002
                    ]
                },
                {
                    "data_path": "action_result.data.*.metro_code",
                    "data_type": "numeric",
                    "example_values": [
                        800
                    ]
                },
                {
                    "data_path": "action_result.data.*.region_code",
                    "data_type": "string",
                    "example_values": [
                        "CA"
                    ]
                },
                {
                    "data_path": "action_result.data.*.region_name",
                    "data_type": "string",
                    "column_name": "Region",
                    "column_order": 2,
                    "example_values": [
                        "California"
                    ]
                },
                {
                    "data_path": "action_result.data.*.time_zone",
                    "data_type": "string",
                    "example_values": [
                        "America/Los_Angeles"
                    ]
                },
                {
                    "data_path": "action_result.data.*.type",
                    "data_type": "string",
                    "example_values": [
                        "ipv6"
                    ]
                },
                {
                    "data_path": "action_result.data.*.zip",
                    "data_type": "string"
                },
                {
                    "data_path": "action_result.data.*.zip_code",
                    "data_type": "string",
                    "example_values": [
                        "94003"
                    ]
                },
                {
                    "data_path": "action_result.summary.city",
                    "data_type": "string",
                    "example_values": [
                        "Mountain View"
                    ]
                },
                {
                    "data_path": "action_result.summary.country_code",
                    "data_type": "string",
                    "example_values": [
                        "US"
                    ]
                },
                {
                    "data_path": "action_result.message",
                    "data_type": "string",
                    "example_values": [
                        "City: Mountain View, Country code: US",
                        "City: None, Country code: US"
                    ]
                },
                {
                    "data_path": "summary.total_objects",
                    "data_type": "numeric",
                    "example_values": [
                        1
                    ]
                },
                {
                    "data_path": "summary.total_objects_successful",
                    "data_type": "numeric",
                    "example_values": [
                        1
                    ]
                }
            ],
            "render": {
                "type": "table"
            },
            "versions": "EQ(*)"
        }
    ],
    "pip39_dependencies": {
        "wheel": []
    },
    "pip313_dependencies": {
        "wheel": []
    }
}

README.md

#### Action Output

DATA PATH | TYPE | CONTAINS | EXAMPLE VALUES
--------- | ---- | -------- | --------------
action_result.status | string | | success failed |
action_result.parameter.ip | string | `ip` `ipv6` | 192.168.0.10 24a6:205:c00b:98f7:9103:6255:bf6:19d5 |
action_result.data.\*.city | string | | Mountain View |
action_result.data.\*.continent_code | string | | AS |
action_result.data.\*.continent_name | string | | Asia |
action_result.data.\*.country_code | string | | US |
action_result.data.\*.country_name | string | | United States |
action_result.data.\*.ip | string | `ip` `ipv6` | 216.58.100.174 2405:205:c00b:98f7:9103:6255:bf6:19d5 |
action_result.data.\*.latitude | numeric | | 37.4002 23.0013 |
action_result.data.\*.location.calling_code | string | | 91 |
action_result.data.\*.location.capital | string | | Washington D.C. |
action_result.data.\*.location.country_flag | string | `url` | http://assets.ipstack.com/flags/in.svg |
action_result.data.\*.location.country_flag_emoji | string | | 🆪🇳 |
action_result.data.\*.location.country_flag_emoji_unicode | string | | U+1F1EE U+1F1F3 |
action_result.data.\*.location.geoname_id | numeric | | 1270033 |
action_result.data.\*.location.is_eu | boolean | | True False |
action_result.data.\*.location.languages.\*.code | string | | hi |
action_result.data.\*.location.languages.\*.name | string | | English |
action_result.data.\*.location.languages.\*.native | string | | हन्दी |
action_result.data.\*.longitude | numeric | | -122.0004 72.6007 |
action_result.data.\*.metro_code | numeric | | 800 |
action_result.data.\*.region_code | string | | CA |
action_result.data.\*.region_name | string | | California |
action_result.data.\*.time_zone | string | | America/Los_Angeles |
action_result.data.\*.type | string | | ipv6 |
action_result.data.\*.zip | string | | 980000 |
action_result.data.\*.zip_code | string | | 94003 |
action_result.summary.city | string | | Mountain View |
action_result.summary.country_code | string | | US |
action_result.message | string | | City: Mountain View, Country code: US |
summary.total_objects | numeric | | 1 |
summary.total_objects_successful | numeric | | 1 |

DATA PATH | TYPE | CONTAINS | EXAMPLE VALUES
--------- | ---- | -------- | --------------
action_result.status | string | | success failed |
action_result.parameter.domain | string | `domain` `url` | https://test.com test.com |
action_result.data.\*.city | string | | Mountain View |
action_result.data.\*.continent_code | string | | NA |
action_result.data.\*.continent_name | string | | North America |
action_result.data.\*.country_code | string | | US |
action_result.data.\*.country_name | string | | United States |
action_result.data.\*.ip | string | `ip` `ipv6` | 192.168.0.4 2607:f8a0:4005:80b::230c |
action_result.data.\*.latitude | numeric | | 37.4002 37.001 |
action_result.data.\*.location.calling_code | string | | 1 |
action_result.data.\*.location.capital | string | | Washington D.C. |
action_result.data.\*.location.country_flag | string | `url` | http://path.to.api.com/flags/us.svg |
action_result.data.\*.location.country_flag_emoji | string | | 🆪🇸 |
action_result.data.\*.location.country_flag_emoji_unicode | string | | U+1F1FA U+1F1F8 |
action_result.data.\*.location.geoname_id | numeric | | 2964574 |
action_result.data.\*.location.is_eu | boolean | | True False |
action_result.data.\*.location.languages.\*.code | string | | en |
action_result.data.\*.location.languages.\*.name | string | | English |
action_result.data.\*.location.languages.\*.native | string | | English |
action_result.data.\*.longitude | numeric | | -122.0004 -97.002 |
action_result.data.\*.metro_code | numeric | | 800 |
action_result.data.\*.region_code | string | | CA |
action_result.data.\*.region_name | string | | California |
action_result.data.\*.time_zone | string | | America/Los_Angeles |
action_result.data.\*.type | string | | ipv6 |
action_result.data.\*.zip | string | | |
action_result.data.\*.zip_code | string | | 94003 |
action_result.summary.city | string | | Mountain View |
action_result.summary.country_code | string | | US |
action_result.message | string | | City: Mountain View, Country code: US City: None, Country code: US |
summary.total_objects | numeric | | 1 |
summary.total_objects_successful | numeric | | 1 |